No.,Time,Source,Destination,Protocol,Length,Info,,,,,,,,,,,,,,,time 2,time 1,delay 1,delay 2,jiter
2,2.92771,69.171.250.60,192.168.43.53,TLSv1.2,582,Application Data,,,,,,,,,,,,,,,2.971888,2.92771,0.044178,0.185776,0.141598
3,2.971888,192.168.43.53,69.171.250.60,TCP,54,53246  >  443 [ACK] Seq=1 Ack=529 Win=64752 Len=0,,,,,,,,,,,,,,,3.157664,2.971888,0.185776,0.041071,0.144705
7,3.157664,192.168.43.53,104.214.78.152,TCP,74,53435  >  443 [SYN] Seq=0 Win=65160 Len=0 MSS=1460 WS=256 SACK_PERM=1 TSval=116571786 TSecr=0,,,,,,,,,,,,,,,3.198735,3.157664,0.041071,0.000165,0.040906
8,3.198735,104.214.78.152,192.168.43.53,TCP,70,"443  >  53435 [SYN, ACK] Seq=0 Ack=1 Win=4380 Len=0 MSS=1360 SACK_PERM=1 TSval=1043004448 TSecr=116571786",,,,,,,,,,,,,,,3.1989,3.198735,0.000165,0.008265,0.0081
9,3.1989,192.168.43.53,104.214.78.152,TCP,66,53435  >  443 [ACK] Seq=1 Ack=1 Win=65160 Len=0 TSval=116571828 TSecr=1043004448,,,,,,,,,,,,,,,3.207165,3.1989,0.008265,0.040968,0.032703
10,3.207165,192.168.43.53,104.214.78.152,TLSv1.2,280,Client Hello,,,,,,,,,,,,,,,3.248133,3.207165,0.040968,4.009356,3.968388
11,3.248133,104.214.78.152,192.168.43.53,TCP,66,443  >  53435 [ACK] Seq=1 Ack=215 Win=4054 Len=0 TSval=1043004457 TSecr=116571836,,,,,,,,,,,,,,,7.257489,3.248133,4.009356,0.000629,4.008727
15,7.257489,104.214.78.152,192.168.43.53,TCP,54,"443  >  53435 [RST, ACK] Seq=1 Ack=215 Win=0 Len=0",,,,,,,,,,,,,,,7.258118,7.257489,0.000629,0.077349,0.07672
16,7.258118,192.168.43.53,104.214.78.152,TCP,74,53436  >  443 [SYN] Seq=0 Win=65160 Len=0 MSS=1460 WS=256 SACK_PERM=1 TSval=116575887 TSecr=0,,,,,,,,,,,,,,,7.335467,7.258118,0.077349,0.000146,0.077203
17,7.335467,104.214.78.152,192.168.43.53,TCP,70,"443  >  53436 [SYN, ACK] Seq=0 Ack=1 Win=4380 Len=0 MSS=1360 SACK_PERM=1 TSval=3685449760 TSecr=116575887",,,,,,,,,,,,,,,7.335613,7.335467,0.000146,0.014572,0.014426
18,7.335613,192.168.43.53,104.214.78.152,TCP,66,53436  >  443 [ACK] Seq=1 Ack=1 Win=65160 Len=0 TSval=116575965 TSecr=3685449760,,,,,,,,,,,,,,,7.350185,7.335613,0.014572,0.073731,0.059159
19,7.350185,192.168.43.53,104.214.78.152,TLSv1,214,Client Hello,,,,,,,,,,,,,,,7.423916,7.350185,0.073731,4.317321,4.24359
20,7.423916,104.214.78.152,192.168.43.53,TCP,66,443  >  53436 [ACK] Seq=1 Ack=149 Win=3988 Len=0 TSval=3685449784 TSecr=116575979,,,,,,,,,,,,,,,11.741237,7.423916,4.317321,0,4.317321
22,11.741237,69.171.250.60,192.168.43.53,TLSv1.2,310,Application Data,,,,,,,,,,,,,,,11.741237,11.741237,0,0.000135,0.000135
23,11.741237,104.214.78.152,192.168.43.53,TCP,66,"443  >  53436 [FIN, ACK] Seq=1 Ack=149 Win=3988 Len=0 TSval=3685454118 TSecr=116575979",,,,,,,,,,,,,,,11.741372,11.741237,0.000135,0.030228,0.030093
24,11.741372,192.168.43.53,104.214.78.152,TCP,66,53436  >  443 [ACK] Seq=149 Ack=2 Win=65160 Len=0 TSval=116580370 TSecr=3685454118,,,,,,,,,,,,,,,11.7716,11.741372,0.030228,0.007122,0.023106
25,11.7716,192.168.43.53,104.214.78.152,TCP,66,"53436  >  443 [FIN, ACK] Seq=149 Ack=2 Win=65160 Len=0 TSval=116580401 TSecr=3685454118",,,,,,,,,,,,,,,11.778722,11.7716,0.007122,0.002231,0.004891
26,11.778722,192.168.43.53,104.214.78.152,TCP,74,53437  >  443 [SYN] Seq=0 Win=65160 Len=0 MSS=1460 WS=256 SACK_PERM=1 TSval=116580408 TSecr=0,,,,,,,,,,,,,,,11.780953,11.778722,0.002231,0.036471,0.03424
27,11.780953,192.168.43.53,69.171.250.60,TCP,54,53246  >  443 [ACK] Seq=1 Ack=785 Win=64496 Len=0,,,,,,,,,,,,,,,11.817424,11.780953,0.036471,0.000154,0.036317
28,11.817424,104.214.78.152,192.168.43.53,TCP,70,"443  >  53437 [SYN, ACK] Seq=0 Ack=1 Win=4380 Len=0 MSS=1360 SACK_PERM=1 TSval=1702853664 TSecr=116580408",,,,,,,,,,,,,,,11.817578,11.817424,0.000154,0.001157,0.001003
29,11.817578,192.168.43.53,104.214.78.152,TCP,66,53437  >  443 [ACK] Seq=1 Ack=1 Win=65160 Len=0 TSval=116580447 TSecr=1702853664,,,,,,,,,,,,,,,11.818735,11.817578,0.001157,0.004227,0.00307
30,11.818735,192.168.43.53,104.214.78.152,SSLv3,118,Client Hello,,,,,,,,,,,,,,,11.822962,11.818735,0.004227,0.073403,0.069176
31,11.822962,104.214.78.152,192.168.43.53,TCP,66,443  >  53436 [ACK] Seq=2 Ack=150 Win=3988 Len=0 TSval=3685454208 TSecr=116580401,,,,,,,,,,,,,,,11.896365,11.822962,0.073403,2.500594,2.427191
32,11.896365,104.214.78.152,192.168.43.53,TCP,66,443  >  53437 [ACK] Seq=1 Ack=53 Win=3892 Len=0 TSval=1702853667 TSecr=116580447,,,,,,,,,,,,,,,14.396959,11.896365,2.500594,0.000533,2.500061
34,14.396959,192.168.43.53,172.217.194.138,TLSv1.2,173,Application Data,,,,,,,,,,,,,,,14.397492,14.396959,0.000533,0.000379,0.000154
35,14.397492,192.168.43.53,172.217.194.138,TLSv1.2,93,Application Data,,,,,,,,,,,,,,,14.397871,14.397492,0.000379,0,0.000379
36,14.397871,192.168.43.53,172.217.194.138,TCP,1414,53432  >  443 [ACK] Seq=159 Ack=1 Win=65280 Len=1360 [TCP segment of a reassembled PDU],,,,,,,,,,,,,,,14.397871,14.397871,0,0.071429,0.071429
37,14.397871,192.168.43.53,172.217.194.138,TLSv1.2,80,Application Data,,,,,,,,,,,,,,,14.4693,14.397871,0.071429,0.010013,0.061416
38,14.4693,172.217.194.138,192.168.43.53,TCP,54,443  >  53432 [ACK] Seq=1 Ack=159 Win=6873 Len=0,,,,,,,,,,,,,,,14.479313,14.4693,0.010013,0,0.010013
39,14.479313,172.217.194.138,192.168.43.53,TCP,54,443  >  53432 [ACK] Seq=1 Ack=120 Win=6834 Len=0,,,,,,,,,,,,,,,14.479313,14.479313,0,0.041672,0.041672
40,14.479313,172.217.194.138,192.168.43.53,TLSv1.2,93,Application Data,,,,,,,,,,,,,,,14.520985,14.479313,0.041672,0.054356,0.012684
41,14.520985,192.168.43.53,172.217.194.138,TCP,54,53432  >  443 [ACK] Seq=1545 Ack=40 Win=65241 Len=0,,,,,,,,,,,,,,,14.575341,14.520985,0.054356,0.003045,0.051311
42,14.575341,172.217.194.138,192.168.43.53,TCP,54,443  >  53432 [ACK] Seq=40 Ack=1545 Win=8259 Len=0,,,,,,,,,,,,,,,14.578386,14.575341,0.003045,0.079299,0.076254
43,14.578386,172.217.194.138,192.168.43.53,TCP,54,443  >  53432 [ACK] Seq=40 Ack=1519 Win=8233 Len=0,,,,,,,,,,,,,,,14.657685,14.578386,0.079299,0.003198,0.076101
44,14.657685,172.217.194.138,192.168.43.53,TLSv1.2,135,Application Data,,,,,,,,,,,,,,,14.660883,14.657685,0.003198,0.000102,0.003096
45,14.660883,172.217.194.138,192.168.43.53,TLSv1.2,452,Application Data,,,,,,,,,,,,,,,14.660985,14.660883,0.000102,0.035745,0.035643
46,14.660985,192.168.43.53,172.217.194.138,TCP,54,53432  >  443 [ACK] Seq=1545 Ack=519 Win=64762 Len=0,,,,,,,,,,,,,,,14.69673,14.660985,0.035745,0,0.035745
47,14.69673,172.217.194.138,192.168.43.53,TLSv1.2,273,"Application Data, Application Data",,,,,,,,,,,,,,,14.69673,14.69673,0,0.000103,0.000103
48,14.69673,172.217.194.138,192.168.43.53,TLSv1.2,93,Application Data,,,,,,,,,,,,,,,14.696833,14.69673,0.000103,0.002091,0.001988
49,14.696833,192.168.43.53,172.217.194.138,TCP,54,53432  >  443 [ACK] Seq=1545 Ack=777 Win=64504 Len=0,,,,,,,,,,,,,,,14.698924,14.696833,0.002091,0.076435,0.074344
50,14.698924,192.168.43.53,172.217.194.138,TLSv1.2,93,Application Data,,,,,,,,,,,,,,,14.775359,14.698924,0.076435,1.268158,1.191723
51,14.775359,172.217.194.138,192.168.43.53,TCP,54,443  >  53432 [ACK] Seq=777 Ack=1584 Win=8298 Len=0,,,,,,,,,,,,,,,16.043517,14.775359,1.268158,0.440254,0.827904
53,16.043517,104.214.78.152,192.168.43.53,TCP,54,"443  >  53437 [RST, ACK] Seq=1 Ack=53 Win=0 Len=0",,,,,,,,,,,,,,,16.483771,16.043517,0.440254,0.332204,0.10805
57,16.483771,192.168.43.53,104.214.78.152,TCP,74,53438  >  443 [SYN] Seq=0 Win=65160 Len=0 MSS=1460 WS=256 SACK_PERM=1 TSval=116585113 TSecr=0,,,,,,,,,,,,,,,16.815975,16.483771,0.332204,0.00016,0.332044
58,16.815975,104.214.78.152,192.168.43.53,TCP,70,"443  >  53438 [SYN, ACK] Seq=0 Ack=1 Win=4380 Len=0 MSS=1360 SACK_PERM=1 TSval=2847500320 TSecr=116585113",,,,,,,,,,,,,,,16.816135,16.815975,0.00016,0.001256,0.001096
59,16.816135,192.168.43.53,104.214.78.152,TCP,66,53438  >  443 [ACK] Seq=1 Ack=1 Win=65160 Len=0 TSval=116585445 TSecr=2847500320,,,,,,,,,,,,,,,16.817391,16.816135,0.001256,0.043404,0.042148
60,16.817391,192.168.43.53,104.214.78.152,TLSv1.2,280,Client Hello,,,,,,,,,,,,,,,16.860795,16.817391,0.043404,4.318412,4.275008
61,16.860795,104.214.78.152,192.168.43.53,TCP,66,443  >  53438 [ACK] Seq=1 Ack=215 Win=4054 Len=0 TSval=2847500322 TSecr=116585445,,,,,,,,,,,,,,,21.179207,16.860795,4.318412,0.007075,4.311337
62,21.179207,104.214.78.152,192.168.43.53,TCP,54,"443  >  53438 [RST, ACK] Seq=1 Ack=215 Win=0 Len=0",,,,,,,,,,,,,,,21.186282,21.179207,0.007075,0.439932,0.432857
63,21.186282,192.168.43.53,104.214.78.152,TCP,74,53439  >  443 [SYN] Seq=0 Win=65160 Len=0 MSS=1460 WS=256 SACK_PERM=1 TSval=116589815 TSecr=0,,,,,,,,,,,,,,,21.626214,21.186282,0.439932,0.000345,0.439587
64,21.626214,104.214.78.152,192.168.43.53,TCP,70,"443  >  53439 [SYN, ACK] Seq=0 Ack=1 Win=4380 Len=0 MSS=1360 SACK_PERM=1 TSval=513524768 TSecr=116589815",,,,,,,,,,,,,,,21.626559,21.626214,0.000345,0.033167,0.032822
65,21.626559,192.168.43.53,104.214.78.152,TCP,66,53439  >  443 [ACK] Seq=1 Ack=1 Win=65160 Len=0 TSval=116590256 TSecr=513524768,,,,,,,,,,,,,,,21.659726,21.626559,0.033167,0.874667,0.8415
66,21.659726,192.168.43.53,104.214.78.152,TLSv1,214,Client Hello,,,,,,,,,,,,,,,22.534393,21.659726,0.874667,1.364089,0.489422
69,22.534393,192.168.43.53,104.214.78.152,TCP,214,"[TCP Retransmission] 53439  >  443 [PSH, ACK] Seq=1 Ack=1 Win=65160 Len=148 TSval=116591164 TSecr=513524768",,,,,,,,,,,,,,,23.898482,22.534393,1.364089,0.210432,1.153657
70,23.898482,192.168.43.53,104.214.78.152,TCP,214,"[TCP Retransmission] 53439  >  443 [PSH, ACK] Seq=1 Ack=1 Win=65160 Len=148 TSval=116592528 TSecr=513524768",,,,,,,,,,,,,,,24.108914,23.898482,0.210432,0,0.210432
71,24.108914,104.214.78.152,192.168.43.53,TCP,66,443  >  53439 [ACK] Seq=1 Ack=149 Win=3988 Len=0 TSval=513524768 TSecr=116591164,,,,,,,,,,,,,,,24.108914,24.108914,0,0.226941,0.226941
72,24.108914,104.214.78.152,192.168.43.53,TCP,66,[TCP Dup ACK 71#1] 443  >  53439 [ACK] Seq=1 Ack=149 Win=3988 Len=0 TSval=513524888 TSecr=116592528,,,,,,,,,,,,,,,24.335855,24.108914,0.226941,0.075425,0.151516
73,24.335855,192.168.43.53,74.125.68.188,TCP,55,53247  >  5228 [ACK] Seq=1 Ack=1 Win=257 Len=1,,,,,,,,,,,,,,,24.41128,24.335855,0.075425,0.931593,0.856168
74,24.41128,74.125.68.188,192.168.43.53,TCP,66,5228  >  53247 [ACK] Seq=1 Ack=2 Win=274 Len=0 SLE=1 SRE=2,,,,,,,,,,,,,,,25.342873,24.41128,0.931593,0.040097,0.891496
75,25.342873,69.171.250.60,192.168.43.53,TLSv1.2,180,Application Data,,,,,,,,,,,,,,,25.38297,25.342873,0.040097,1.415005,1.374908
76,25.38297,192.168.43.53,69.171.250.60,TCP,54,53246  >  443 [ACK] Seq=1 Ack=911 Win=64370 Len=0,,,,,,,,,,,,,,,26.797975,25.38297,1.415005,0.00011,1.414895
79,26.797975,104.214.78.152,192.168.43.53,TCP,66,"443  >  53439 [FIN, ACK] Seq=1 Ack=149 Win=3988 Len=0 TSval=513527719 TSecr=116592528",,,,,,,,,,,,,,,26.798085,26.797975,0.00011,0.000247,0.000137
80,26.798085,192.168.43.53,104.214.78.152,TCP,66,53439  >  443 [ACK] Seq=149 Ack=2 Win=65160 Len=0 TSval=116595427 TSecr=513527719,,,,,,,,,,,,,,,26.798332,26.798085,0.000247,0.00074,0.000493
81,26.798332,192.168.43.53,104.214.78.152,TCP,66,"53439  >  443 [FIN, ACK] Seq=149 Ack=2 Win=65160 Len=0 TSval=116595427 TSecr=513527719",,,,,,,,,,,,,,,26.799072,26.798332,0.00074,0.046929,0.046189
82,26.799072,192.168.43.53,104.214.78.152,TCP,74,53440  >  443 [SYN] Seq=0 Win=65160 Len=0 MSS=1460 WS=256 SACK_PERM=1 TSval=116595427 TSecr=0,,,,,,,,,,,,,,,26.846001,26.799072,0.046929,0.006703,0.040226
83,26.846001,104.214.78.152,192.168.43.53,TCP,66,443  >  53439 [ACK] Seq=2 Ack=150 Win=3988 Len=0 TSval=513527767 TSecr=116595427,,,,,,,,,,,,,,,26.852704,26.846001,0.006703,0.000153,0.00655
84,26.852704,104.214.78.152,192.168.43.53,TCP,70,"443  >  53440 [SYN, ACK] Seq=0 Ack=1 Win=4380 Len=0 MSS=1360 SACK_PERM=1 TSval=3018861600 TSecr=116595427",,,,,,,,,,,,,,,26.852857,26.852704,0.000153,0.001018,0.000865
85,26.852857,192.168.43.53,104.214.78.152,TCP,66,53440  >  443 [ACK] Seq=1 Ack=1 Win=65160 Len=0 TSval=116595482 TSecr=3018861600,,,,,,,,,,,,,,,26.853875,26.852857,0.001018,0.053458,0.05244
86,26.853875,192.168.43.53,104.214.78.152,SSLv3,118,Client Hello,,,,,,,,,,,,,,,26.907333,26.853875,0.053458,1.1551,1.101642
87,26.907333,104.214.78.152,192.168.43.53,TCP,66,443  >  53440 [ACK] Seq=1 Ack=53 Win=3892 Len=0 TSval=3018861600 TSecr=116595482,,,,,,,,,,,,,,,28.062433,26.907333,1.1551,0.052859,1.102241
88,28.062433,69.171.250.60,192.168.43.53,TLSv1.2,143,Application Data,,,,,,,,,,,,,,,28.115292,28.062433,0.052859,1.553916,1.501057
89,28.115292,192.168.43.53,69.171.250.60,TCP,54,53246  >  443 [ACK] Seq=1 Ack=1000 Win=64281 Len=0,,,,,,,,,,,,,,,29.669208,28.115292,1.553916,0.000108,1.553808
90,29.669208,104.214.78.152,192.168.43.53,TCP,66,"443  >  53440 [FIN, ACK] Seq=1 Ack=53 Win=3892 Len=0 TSval=3018864256 TSecr=116595482",,,,,,,,,,,,,,,29.669316,29.669208,0.000108,0.000509,0.000401
91,29.669316,192.168.43.53,104.214.78.152,TCP,66,53440  >  443 [ACK] Seq=53 Ack=2 Win=65160 Len=0 TSval=116598298 TSecr=3018864256,,,,,,,,,,,,,,,29.669825,29.669316,0.000509,0.119156,0.118647
92,29.669825,192.168.43.53,104.214.78.152,TCP,66,"53440  >  443 [FIN, ACK] Seq=53 Ack=2 Win=65160 Len=0 TSval=116598298 TSecr=3018864256",,,,,,,,,,,,,,,29.788981,29.669825,0.119156,6.574682,6.455526
93,29.788981,104.214.78.152,192.168.43.53,TCP,66,443  >  53440 [ACK] Seq=2 Ack=54 Win=3892 Len=0 TSval=3018864446 TSecr=116598298,,,,,,,,,,,,,,,36.363663,29.788981,6.574682,0.00048,6.574202
94,36.363663,192.168.43.53,172.217.194.138,TLSv1.2,173,Application Data,,,,,,,,,,,,,,,36.364143,36.363663,0.00048,0.000393,8.7E-05
95,36.364143,192.168.43.53,172.217.194.138,TLSv1.2,93,Application Data,,,,,,,,,,,,,,,36.364536,36.364143,0.000393,0,0.000393
96,36.364536,192.168.43.53,172.217.194.138,TCP,1414,53432  >  443 [ACK] Seq=1742 Ack=777 Win=64504 Len=1360 [TCP segment of a reassembled PDU],,,,,,,,,,,,,,,36.364536,36.364536,0,0.306725,0.306725
97,36.364536,192.168.43.53,172.217.194.138,TLSv1.2,79,Application Data,,,,,,,,,,,,,,,36.671261,36.364536,0.306725,0.312437,0.005712
98,36.671261,192.168.43.53,172.217.194.138,TCP,1414,"[TCP Retransmission] 53432  >  443 [PSH, ACK] Seq=1767 Ack=777 Win=64504 Len=1360",,,,,,,,,,,,,,,36.983698,36.671261,0.312437,0.612259,0.299822
99,36.983698,192.168.43.53,172.217.194.138,TCP,1414,"[TCP Retransmission] 53432  >  443 [PSH, ACK] Seq=1584 Ack=777 Win=64504 Len=1360",,,,,,,,,,,,,,,37.595957,36.983698,0.612259,0.643961,0.031702
100,37.595957,192.168.43.53,172.217.194.138,TCP,1414,"[TCP Retransmission] 53432  >  443 [PSH, ACK] Seq=1584 Ack=777 Win=64504 Len=1360",,,,,,,,,,,,,,,38.239918,37.595957,0.643961,0.049703,0.594258
101,38.239918,69.171.250.60,192.168.43.53,TLSv1.2,189,Application Data,,,,,,,,,,,,,,,38.289621,38.239918,0.049703,0.515608,0.465905
102,38.289621,192.168.43.53,69.171.250.60,TCP,54,53246  >  443 [ACK] Seq=1 Ack=1135 Win=64146 Len=0,,,,,,,,,,,,,,,38.805229,38.289621,0.515608,2.040219,1.524611
105,38.805229,192.168.43.53,172.217.194.138,TCP,1414,"[TCP Retransmission] 53432  >  443 [PSH, ACK] Seq=1584 Ack=777 Win=64504 Len=1360",,,,,,,,,,,,,,,40.845448,38.805229,2.040219,0.050754,1.989465
106,40.845448,69.171.250.60,192.168.43.53,TLSv1.2,103,Application Data,,,,,,,,,,,,,,,40.896202,40.845448,0.050754,0.312509,0.261755
107,40.896202,192.168.43.53,69.171.250.60,TCP,54,53246  >  443 [ACK] Seq=1 Ack=1184 Win=64097 Len=0,,,,,,,,,,,,,,,41.208711,40.896202,0.312509,2.375102,2.062593
108,41.208711,192.168.43.53,172.217.194.138,TCP,1414,"[TCP Retransmission] 53432  >  443 [PSH, ACK] Seq=1584 Ack=777 Win=64504 Len=1360",,,,,,,,,,,,,,,43.583813,41.208711,2.375102,0.041684,2.333418
109,43.583813,69.171.250.60,192.168.43.53,TLSv1.2,453,Application Data,,,,,,,,,,,,,,,43.625497,43.583813,0.041684,0.000221,0.041463
110,43.625497,69.171.250.60,192.168.43.53,TLSv1.2,934,Application Data,,,,,,,,,,,,,,,43.625718,43.625497,0.000221,1.189051,1.18883
111,43.625718,192.168.43.53,69.171.250.60,TCP,54,53246  >  443 [ACK] Seq=1 Ack=2463 Win=65280 Len=0,,,,,,,,,,,,,,,44.814769,43.625718,1.189051,0,1.189051
112,44.814769,69.171.250.60,192.168.43.53,TLSv1.2,154,Application Data,,,,,,,,,,,,,,,44.814769,44.814769,0,0.000118,0.000118
113,44.814769,69.171.250.60,192.168.43.53,TLSv1.2,278,Application Data,,,,,,,,,,,,,,,44.814887,44.814769,0.000118,0.000202,8.4E-05
114,44.814887,192.168.43.53,69.171.250.60,TCP,54,53246  >  443 [ACK] Seq=1 Ack=2787 Win=64956 Len=0,,,,,,,,,,,,,,,44.815089,44.814887,0.000202,0.017872,0.01767
115,44.815089,69.171.250.60,192.168.43.53,TLSv1.2,374,Application Data,,,,,,,,,,,,,,,44.832961,44.815089,0.017872,0.000103,0.017769
116,44.832961,69.171.250.60,192.168.43.53,TLSv1.2,235,Application Data,,,,,,,,,,,,,,,44.833064,44.832961,0.000103,1.182719,1.182616
117,44.833064,192.168.43.53,69.171.250.60,TCP,54,53246  >  443 [ACK] Seq=1 Ack=3288 Win=64455 Len=0,,,,,,,,,,,,,,,46.015783,44.833064,1.182719,0.511433,0.671286
118,46.015783,192.168.43.53,172.217.194.138,TCP,1414,"[TCP Retransmission] 53432  >  443 [PSH, ACK] Seq=1584 Ack=777 Win=64504 Len=1360",,,,,,,,,,,,,,,46.527216,46.015783,0.511433,0,0.511433
120,46.527216,69.171.250.60,192.168.43.53,TLSv1.2,274,Application Data,,,,,,,,,,,,,,,46.527216,46.527216,0,0.0002,0.0002
121,46.527216,69.171.250.60,192.168.43.53,TLSv1.2,434,"Application Data, Application Data",,,,,,,,,,,,,,,46.527416,46.527216,0.0002,0.002905,0.002705
122,46.527416,192.168.43.53,69.171.250.60,TCP,54,53246  >  443 [ACK] Seq=1 Ack=3888 Win=65280 Len=0,,,,,,,,,,,,,,,46.530321,46.527416,0.002905,0.04793,0.045025
123,46.530321,69.171.250.60,192.168.43.53,TLSv1.2,274,Application Data,,,,,,,,,,,,,,,46.578251,46.530321,0.04793,0.528442,0.480512
124,46.578251,192.168.43.53,69.171.250.60,TCP,54,53246  >  443 [ACK] Seq=1 Ack=4108 Win=65060 Len=0,,,,,,,,,,,,,,,47.106693,46.578251,0.528442,0,0.528442
126,47.106693,172.217.194.138,192.168.43.53,TCP,54,443  >  53432 [ACK] Seq=777 Ack=2944 Win=9658 Len=0,,,,,,,,,,,,,,,47.106693,47.106693,0,0.000124,0.000124
127,47.106693,172.217.194.138,192.168.43.53,TLSv1.2,93,Application Data,,,,,,,,,,,,,,,47.106817,47.106693,0.000124,0.288225,0.288101
128,47.106817,192.168.43.53,172.217.194.138,TCP,54,"53432  >  443 [RST, ACK] Seq=2944 Ack=816 Win=0 Len=0",,,,,,,,,,,,,,,47.395042,47.106817,0.288225,0.092505,0.19572
130,47.395042,192.168.43.53,74.125.68.138,TCP,66,53441  >  443 [SYN] Seq=0 Win=64240 Len=0 MSS=1460 WS=256 SACK_PERM=1,,,,,,,,,,,,,,,47.487547,47.395042,0.092505,0.000147,0.092358
131,47.487547,74.125.68.138,192.168.43.53,TCP,66,"443  >  53441 [SYN, ACK] Seq=0 Ack=1 Win=13600 Len=0 MSS=1360 WS=1 SACK_PERM=1",,,,,,,,,,,,,,,47.487694,47.487547,0.000147,0.000883,0.000736
132,47.487694,192.168.43.53,74.125.68.138,TCP,54,53441  >  443 [ACK] Seq=1 Ack=1 Win=66560 Len=0,,,,,,,,,,,,,,,47.488577,47.487694,0.000883,0.308346,0.307463
133,47.488577,192.168.43.53,74.125.68.138,TLSv1.3,639,Client Hello,,,,,,,,,,,,,,,47.796923,47.488577,0.308346,0.350257,0.041911
134,47.796923,192.168.43.53,74.125.68.138,TCP,639,"[TCP Retransmission] 53441  >  443 [PSH, ACK] Seq=1 Ack=1 Win=66560 Len=585",,,,,,,,,,,,,,,48.14718,47.796923,0.350257,0.600458,0.250201
135,48.14718,192.168.43.53,74.125.68.138,TCP,639,"[TCP Retransmission] 53441  >  443 [PSH, ACK] Seq=1 Ack=1 Win=66560 Len=585",,,,,,,,,,,,,,,48.747638,48.14718,0.600458,0.29738,0.303078
136,48.747638,192.168.43.53,74.125.68.138,TCP,639,"[TCP Retransmission] 53441  >  443 [PSH, ACK] Seq=1 Ack=1 Win=66560 Len=585",,,,,,,,,,,,,,,49.045018,48.747638,0.29738,0.046324,0.251056
137,49.045018,69.171.250.60,192.168.43.53,TLSv1.2,262,Application Data,,,,,,,,,,,,,,,49.091342,49.045018,0.046324,0.067454,0.02113
138,49.091342,192.168.43.53,69.171.250.60,TCP,54,53246  >  443 [ACK] Seq=1 Ack=4316 Win=64852 Len=0,,,,,,,,,,,,,,,49.158796,49.091342,0.067454,0.041923,0.025531
139,49.158796,69.171.250.60,192.168.43.53,TLSv1.2,235,Application Data,,,,,,,,,,,,,,,49.200719,49.158796,0.041923,0.175607,0.133684
140,49.200719,192.168.43.53,69.171.250.60,TCP,54,53246  >  443 [ACK] Seq=1 Ack=4497 Win=64671 Len=0,,,,,,,,,,,,,,,49.376326,49.200719,0.175607,0.845978,0.670371
141,49.376326,74.125.68.138,192.168.43.53,TCP,54,443  >  53441 [ACK] Seq=1 Ack=586 Win=14185 Len=0,,,,,,,,,,,,,,,50.222304,49.376326,0.845978,0.002607,0.843371
142,50.222304,74.125.68.138,192.168.43.53,TLSv1.3,266,"Server Hello, Change Cipher Spec, Application Data",,,,,,,,,,,,,,,50.224911,50.222304,0.002607,0.000786,0.001821
143,50.224911,192.168.43.53,74.125.68.138,TLSv1.3,118,"Change Cipher Spec, Application Data",,,,,,,,,,,,,,,50.225697,50.224911,0.000786,0.000435,0.000351
144,50.225697,192.168.43.53,74.125.68.138,TLSv1.3,146,Application Data,,,,,,,,,,,,,,,50.226132,50.225697,0.000435,0.141427,0.140992
145,50.226132,192.168.43.53,74.125.68.138,TLSv1.3,727,Application Data,,,,,,,,,,,,,,,50.367559,50.226132,0.141427,0.004912,0.136515
146,50.367559,74.125.68.138,192.168.43.53,TCP,54,443  >  53441 [ACK] Seq=213 Ack=650 Win=14249 Len=0,,,,,,,,,,,,,,,50.372471,50.367559,0.004912,5.9E-05,0.004853
147,50.372471,74.125.68.138,192.168.43.53,TCP,54,443  >  53441 [ACK] Seq=213 Ack=742 Win=14341 Len=0,,,,,,,,,,,,,,,50.37253,50.372471,5.9E-05,0,5.9E-05
148,50.37253,192.168.43.53,74.125.68.138,TCP,1414,53441  >  443 [ACK] Seq=1415 Ack=213 Win=66304 Len=1360 [TCP segment of a reassembled PDU],,,,,,,,,,,,,,,50.37253,50.37253,0,0.007753,0.007753
149,50.37253,192.168.43.53,74.125.68.138,TLSv1.3,79,Application Data,,,,,,,,,,,,,,,50.380283,50.37253,0.007753,0.003999,0.003754
150,50.380283,74.125.68.138,192.168.43.53,TCP,54,443  >  53441 [ACK] Seq=213 Ack=1415 Win=15014 Len=0,,,,,,,,,,,,,,,50.384282,50.380283,0.003999,9E-05,0.003909
151,50.384282,74.125.68.138,192.168.43.53,TLSv1.3,85,"[TCP Previous segment not captured] , Application Data",,,,,,,,,,,,,,,50.384372,50.384282,9E-05,0.005654,0.005564
152,50.384372,192.168.43.53,74.125.68.138,TCP,66,[TCP Dup ACK 143#1] 53441  >  443 [ACK] Seq=2800 Ack=213 Win=66304 Len=0 SLE=793 SRE=824,,,,,,,,,,,,,,,50.390026,50.384372,0.005654,0.000113,0.005541
153,50.390026,74.125.68.138,192.168.43.53,TCP,634,"[TCP Out-Of-Order] 443  >  53441 [PSH, ACK] Seq=213 Ack=1415 Win=15014 Len=580",,,,,,,,,,,,,,,50.390139,50.390026,0.000113,0.000792,0.000679
154,50.390139,192.168.43.53,74.125.68.138,TCP,54,53441  >  443 [ACK] Seq=2800 Ack=824 Win=65792 Len=0,,,,,,,,,,,,,,,50.390931,50.390139,0.000792,0.04089,0.040098
155,50.390931,192.168.43.53,74.125.68.138,TLSv1.3,85,Application Data,,,,,,,,,,,,,,,50.431821,50.390931,0.04089,0.003192,0.037698
156,50.431821,74.125.68.138,192.168.43.53,TCP,54,443  >  53441 [ACK] Seq=824 Ack=2775 Win=16374 Len=0,,,,,,,,,,,,,,,50.435013,50.431821,0.003192,0,0.003192
157,50.435013,74.125.68.138,192.168.43.53,TCP,634,[TCP Out-Of-Order] 443  >  53441 [ACK] Seq=213 Ack=1415 Win=15014 Len=580,,,,,,,,,,,,,,,50.435013,50.435013,0,5.1E-05,5.1E-05
158,50.435013,74.125.68.138,192.168.43.53,TCP,54,443  >  53441 [ACK] Seq=824 Ack=2831 Win=16430 Len=0,,,,,,,,,,,,,,,50.435064,50.435013,5.1E-05,0.087255,0.087204
159,50.435064,192.168.43.53,74.125.68.138,TCP,66,[TCP Dup ACK 154#1] 53441  >  443 [ACK] Seq=2831 Ack=824 Win=65792 Len=0 SLE=213 SRE=793,,,,,,,,,,,,,,,50.522319,50.435064,0.087255,0,0.087255
160,50.522319,74.125.68.138,192.168.43.53,TLSv1.3,569,Application Data,,,,,,,,,,,,,,,50.522319,50.522319,0,0,0
161,50.522319,74.125.68.138,192.168.43.53,TLSv1.3,514,Application Data,,,,,,,,,,,,,,,50.522319,50.522319,0,0,0
162,50.522319,74.125.68.138,192.168.43.53,TLSv1.3,337,"Application Data, Application Data",,,,,,,,,,,,,,,50.522319,50.522319,0,0.000141,0.000141
163,50.522319,74.125.68.138,192.168.43.53,TLSv1.3,93,Application Data,,,,,,,,,,,,,,,50.52246,50.522319,0.000141,0.002612,0.002471
164,50.52246,192.168.43.53,74.125.68.138,TCP,54,53441  >  443 [ACK] Seq=2831 Ack=2121 Win=66560 Len=0,,,,,,,,,,,,,,,50.525072,50.52246,0.002612,0.144862,0.14225
165,50.525072,192.168.43.53,74.125.68.138,TLSv1.3,93,Application Data,,,,,,,,,,,,,,,50.669934,50.525072,0.144862,0,0.144862
166,50.669934,69.171.250.60,192.168.43.53,TLSv1.2,214,"[TCP Previous segment not captured] , Application Data",,,,,,,,,,,,,,,50.669934,50.669934,0,9.9E-05,9.9E-05
167,50.669934,69.171.250.60,192.168.43.53,TCP,494,"[TCP Out-Of-Order] 443  >  53246 [PSH, ACK] Seq=4497 Ack=1 Win=22743 Len=440",,,,,,,,,,,,,,,50.670033,50.669934,9.9E-05,0.000191,9.2E-05
168,50.670033,192.168.43.53,69.171.250.60,TCP,66,[TCP Dup ACK 140#1] 53246  >  443 [ACK] Seq=1 Ack=4497 Win=64671 Len=0 SLE=4937 SRE=5097,,,,,,,,,,,,,,,50.670224,50.670033,0.000191,0.013158,0.012967
169,50.670224,192.168.43.53,69.171.250.60,TCP,54,53246  >  443 [ACK] Seq=1 Ack=5097 Win=64071 Len=0,,,,,,,,,,,,,,,50.683382,50.670224,0.013158,0.04983,0.036672
170,50.683382,69.171.250.60,192.168.43.53,TLSv1.2,274,Application Data,,,,,,,,,,,,,,,50.733212,50.683382,0.04983,0.093754,0.043924
171,50.733212,192.168.43.53,69.171.250.60,TCP,54,53246  >  443 [ACK] Seq=1 Ack=5317 Win=65280 Len=0,,,,,,,,,,,,,,,50.826966,50.733212,0.093754,0.045679,0.048075
172,50.826966,192.168.43.53,74.125.68.138,TCP,93,"[TCP Retransmission] 53441  >  443 [PSH, ACK] Seq=2831 Ack=2121 Win=66560 Len=39",,,,,,,,,,,,,,,50.872645,50.826966,0.045679,6.583413,6.537734
173,50.872645,74.125.68.138,192.168.43.53,TCP,54,443  >  53441 [ACK] Seq=2121 Ack=2870 Win=16469 Len=0,,,,,,,,,,,,,,,57.456058,50.872645,6.583413,0.016098,6.567315
176,57.456058,69.171.250.60,192.168.43.53,TLSv1.2,374,Application Data,,,,,,,,,,,,,,,57.472156,57.456058,0.016098,9.9E-05,0.015999
177,57.472156,69.171.250.60,192.168.43.53,TLSv1.2,235,Application Data,,,,,,,,,,,,,,,57.472255,57.472156,9.9E-05,1.298184,1.298085
178,57.472255,192.168.43.53,69.171.250.60,TCP,54,53246  >  443 [ACK] Seq=1 Ack=5818 Win=64779 Len=0,,,,,,,,,,,,,,,58.770439,57.472255,1.298184,0.019628,1.278556
179,58.770439,69.171.250.60,192.168.43.53,TLSv1.2,274,Application Data,,,,,,,,,,,,,,,58.790067,58.770439,0.019628,0.000214,0.019414
180,58.790067,69.171.250.60,192.168.43.53,TLSv1.2,274,Application Data,,,,,,,,,,,,,,,58.790281,58.790067,0.000214,0.043289,0.043075
181,58.790281,192.168.43.53,69.171.250.60,TCP,54,53246  >  443 [ACK] Seq=1 Ack=6258 Win=64339 Len=0,,,,,,,,,,,,,,,58.83357,58.790281,0.043289,0.045808,0.002519
182,58.83357,69.171.250.60,192.168.43.53,TLSv1.2,412,Application Data,,,,,,,,,,,,,,,58.879378,58.83357,0.045808,7.150251,7.104443
183,58.879378,192.168.43.53,69.171.250.60,TCP,54,53246  >  443 [ACK] Seq=1 Ack=6616 Win=63981 Len=0,,,,,,,,,,,,,,,66.029629,58.879378,7.150251,0.000299,7.149952
188,66.029629,69.171.250.60,192.168.43.53,TLSv1.2,262,Application Data,,,,,,,,,,,,,,,66.029928,66.029629,0.000299,0.000143,0.000156
189,66.029928,69.171.250.60,192.168.43.53,TLSv1.2,235,Application Data,,,,,,,,,,,,,,,66.030071,66.029928,0.000143,1.099024,1.098881
190,66.030071,192.168.43.53,69.171.250.60,TCP,54,53246  >  443 [ACK] Seq=1 Ack=7005 Win=65280 Len=0,,,,,,,,,,,,,,,67.129095,66.030071,1.099024,0.000113,1.098911
191,67.129095,69.171.250.60,192.168.43.53,TLSv1.2,274,Application Data,,,,,,,,,,,,,,,67.129208,67.129095,0.000113,4.3E-05,7E-05
192,67.129208,69.171.250.60,192.168.43.53,TLSv1.2,274,Application Data,,,,,,,,,,,,,,,67.129251,67.129208,4.3E-05,0.288687,0.288644
193,67.129251,192.168.43.53,69.171.250.60,TCP,54,53246  >  443 [ACK] Seq=1 Ack=7445 Win=64840 Len=0,,,,,,,,,,,,,,,67.417938,67.129251,0.288687,0,0.288687
194,67.417938,69.171.250.60,192.168.43.53,TLSv1.2,274,Application Data,,,,,,,,,,,,,,,67.417938,67.417938,0,0.00011,0.00011
195,67.417938,69.171.250.60,192.168.43.53,TLSv1.2,214,Application Data,,,,,,,,,,,,,,,67.418048,67.417938,0.00011,2.00465,2.00454
196,67.418048,192.168.43.53,69.171.250.60,TCP,54,53246  >  443 [ACK] Seq=1 Ack=7825 Win=64460 Len=0,,,,,,,,,,,,,,,69.422698,67.418048,2.00465,0.212543,1.792107
198,69.422698,192.168.43.53,74.125.68.188,TCP,55,[TCP Keep-Alive] 53247  >  5228 [ACK] Seq=1 Ack=1 Win=257 Len=1,,,,,,,,,,,,,,,69.635241,69.422698,0.212543,13.455907,13.243364
199,69.635241,74.125.68.188,192.168.43.53,TCP,66,[TCP Keep-Alive ACK] 5228  >  53247 [ACK] Seq=1 Ack=2 Win=274 Len=0 SLE=1 SRE=2,,,,,,,,,,,,,,,83.091148,69.635241,13.455907,0.008907,13.447
205,83.091148,69.171.250.60,192.168.43.53,TLSv1.2,374,Application Data,,,,,,,,,,,,,,,83.100055,83.091148,0.008907,9.4E-05,0.008813
206,83.100055,69.171.250.60,192.168.43.53,TLSv1.2,235,Application Data,,,,,,,,,,,,,,,83.100149,83.100055,9.4E-05,1.208756,1.208662
207,83.100149,192.168.43.53,69.171.250.60,TCP,54,53246  >  443 [ACK] Seq=1 Ack=8326 Win=63959 Len=0,,,,,,,,,,,,,,,84.308905,83.100149,1.208756,0.003861,1.204895
208,84.308905,69.171.250.60,192.168.43.53,TLSv1.2,214,Application Data,,,,,,,,,,,,,,,84.312766,84.308905,0.003861,0.000102,0.003759
209,84.312766,69.171.250.60,192.168.43.53,TLSv1.2,494,"Application Data, Application Data",,,,,,,,,,,,,,,84.312868,84.312766,0.000102,0.000445,0.000343
210,84.312868,192.168.43.53,69.171.250.60,TCP,54,53246  >  443 [ACK] Seq=1 Ack=8926 Win=65280 Len=0,,,,,,,,,,,,,,,84.313313,84.312868,0.000445,3.2E-05,0.000413
211,84.313313,69.171.250.60,192.168.43.53,TLSv1.2,274,Application Data,,,,,,,,,,,,,,,84.313345,84.313313,3.2E-05,5.430496,5.430464
212,84.313345,192.168.43.53,69.171.250.60,TCP,54,53246  >  443 [ACK] Seq=1 Ack=9146 Win=65060 Len=0,,,,,,,,,,,,,,,89.743841,84.313345,5.430496,0.037565,5.392931
215,89.743841,69.171.250.60,192.168.43.53,TLSv1.2,262,Application Data,,,,,,,,,,,,,,,89.781406,89.743841,0.037565,1E-04,0.037465
216,89.781406,69.171.250.60,192.168.43.53,TLSv1.2,235,Application Data,,,,,,,,,,,,,,,89.781506,89.781406,1E-04,0.634809,0.634709
217,89.781506,192.168.43.53,69.171.250.60,TCP,54,53246  >  443 [ACK] Seq=1 Ack=9535 Win=64671 Len=0,,,,,,,,,,,,,,,90.416315,89.781506,0.634809,0.006664,0.628145
218,90.416315,69.171.250.60,192.168.43.53,TLSv1.2,274,Application Data,,,,,,,,,,,,,,,90.422979,90.416315,0.006664,9.8E-05,0.006566
219,90.422979,69.171.250.60,192.168.43.53,TLSv1.2,143,Application Data,,,,,,,,,,,,,,,90.423077,90.422979,9.8E-05,0.107825,0.107727
220,90.423077,192.168.43.53,69.171.250.60,TCP,54,53246  >  443 [ACK] Seq=1 Ack=9844 Win=64362 Len=0,,,,,,,,,,,,,,,90.530902,90.423077,0.107825,0.029366,0.078459
221,90.530902,69.171.250.60,192.168.43.53,TLSv1.2,274,Application Data,,,,,,,,,,,,,,,90.560268,90.530902,0.029366,9.9E-05,0.029267
222,90.560268,69.171.250.60,192.168.43.53,TLSv1.2,434,"Application Data, Application Data",,,,,,,,,,,,,,,90.560367,90.560268,9.9E-05,0.036716,0.036617
223,90.560367,192.168.43.53,69.171.250.60,TCP,54,53246  >  443 [ACK] Seq=1 Ack=10444 Win=65280 Len=0,,,,,,,,,,,,,,,90.597083,90.560367,0.036716,0.051124,0.014408
224,90.597083,69.171.250.60,192.168.43.53,TLSv1.2,180,Application Data,,,,,,,,,,,,,,,90.648207,90.597083,0.051124,0.674756,0.623632
225,90.648207,192.168.43.53,69.171.250.60,TCP,54,53246  >  443 [ACK] Seq=1 Ack=10570 Win=65154 Len=0,,,,,,,,,,,,,,,91.322963,90.648207,0.674756,0.054888,0.619868
226,91.322963,69.171.250.60,192.168.43.53,TLSv1.2,224,Application Data,,,,,,,,,,,,,,,91.377851,91.322963,0.054888,4.504744,4.449856
227,91.377851,192.168.43.53,69.171.250.60,TCP,54,53246  >  443 [ACK] Seq=1 Ack=10740 Win=64984 Len=0,,,,,,,,,,,,,,,95.882595,91.377851,4.504744,0.076885,4.427859
228,95.882595,192.168.43.53,74.125.68.138,TCP,55,[TCP Keep-Alive] 53441  >  443 [ACK] Seq=2869 Ack=2121 Win=66560 Len=1,,,,,,,,,,,,,,,95.95948,95.882595,0.076885,5.775683,5.698798
229,95.95948,74.125.68.138,192.168.43.53,TCP,54,[TCP Keep-Alive ACK] 443  >  53441 [ACK] Seq=2121 Ack=2870 Win=16469 Len=0,,,,,,,,,,,,,,,101.735163,95.95948,5.775683,0.000495,5.775188
236,101.735163,192.168.43.53,74.125.68.138,TLSv1.3,173,Application Data,,,,,,,,,,,,,,,101.735658,101.735163,0.000495,0.000396,9.9E-05
237,101.735658,192.168.43.53,74.125.68.138,TLSv1.3,93,Application Data,,,,,,,,,,,,,,,101.736054,101.735658,0.000396,0.156138,0.155742
238,101.736054,192.168.43.53,74.125.68.138,TLSv1.3,1404,Application Data,,,,,,,,,,,,,,,101.892192,101.736054,0.156138,0.016867,0.139271
239,101.892192,74.125.68.138,192.168.43.53,TCP,54,443  >  53441 [ACK] Seq=2121 Ack=2989 Win=16588 Len=0,,,,,,,,,,,,,,,101.909059,101.892192,0.016867,0.003853,0.013014
240,101.909059,74.125.68.138,192.168.43.53,TCP,54,443  >  53441 [ACK] Seq=2121 Ack=3028 Win=16627 Len=0,,,,,,,,,,,,,,,101.912912,101.909059,0.003853,0.00319,0.000663
241,101.912912,74.125.68.138,192.168.43.53,TLSv1.3,93,Application Data,,,,,,,,,,,,,,,101.916102,101.912912,0.00319,0.048373,0.045183
242,101.916102,74.125.68.138,192.168.43.53,TCP,54,443  >  53441 [ACK] Seq=2160 Ack=4378 Win=17977 Len=0,,,,,,,,,,,,,,,101.964475,101.916102,0.048373,0.103841,0.055468
243,101.964475,192.168.43.53,74.125.68.138,TCP,54,53441  >  443 [ACK] Seq=4378 Ack=2160 Win=66560 Len=0,,,,,,,,,,,,,,,102.068316,101.964475,0.103841,0.052462,0.051379
244,102.068316,74.125.68.138,192.168.43.53,TLSv1.3,135,Application Data,,,,,,,,,,,,,,,102.120778,102.068316,0.052462,0.036706,0.015756
245,102.120778,192.168.43.53,74.125.68.138,TCP,54,53441  >  443 [ACK] Seq=4378 Ack=2241 Win=66304 Len=0,,,,,,,,,,,,,,,102.157484,102.120778,0.036706,0,0.036706
246,102.157484,74.125.68.138,192.168.43.53,TLSv1.3,559,Application Data,,,,,,,,,,,,,,,102.157484,102.157484,0,0,0
247,102.157484,74.125.68.138,192.168.43.53,TLSv1.3,262,"Application Data, Application Data",,,,,,,,,,,,,,,102.157484,102.157484,0,0.000128,0.000128
248,102.157484,74.125.68.138,192.168.43.53,TLSv1.3,93,Application Data,,,,,,,,,,,,,,,102.157612,102.157484,0.000128,0.001118,0.00099
249,102.157612,192.168.43.53,74.125.68.138,TCP,54,53441  >  443 [ACK] Seq=4378 Ack=2993 Win=65536 Len=0,,,,,,,,,,,,,,,102.15873,102.157612,0.001118,0.171404,0.170286
250,102.15873,192.168.43.53,74.125.68.138,TLSv1.3,93,Application Data,,,,,,,,,,,,,,,102.330134,102.15873,0.171404,0.257276,0.085872
251,102.330134,74.125.68.138,192.168.43.53,TCP,54,443  >  53441 [ACK] Seq=2993 Ack=4417 Win=18016 Len=0,,,,,,,,,,,,,,,102.58741,102.330134,0.257276,0.043707,0.213569
252,102.58741,69.171.250.60,192.168.43.53,TLSv1.2,262,Application Data,,,,,,,,,,,,,,,102.631117,102.58741,0.043707,1.162264,1.118557
253,102.631117,192.168.43.53,69.171.250.60,TCP,54,53246  >  443 [ACK] Seq=1 Ack=10948 Win=64776 Len=0,,,,,,,,,,,,,,,103.793381,102.631117,1.162264,9.6E-05,1.162168
254,103.793381,69.171.250.60,192.168.43.53,TLSv1.2,262,"[TCP Spurious Retransmission] , Application Data",,,,,,,,,,,,,,,103.793477,103.793381,9.6E-05,0.441666,0.44157
255,103.793477,192.168.43.53,69.171.250.60,TCP,66,[TCP Dup ACK 253#1] 53246  >  443 [ACK] Seq=1 Ack=10948 Win=64776 Len=0 SLE=10740 SRE=10948,,,,,,,,,,,,,,,104.235143,103.793477,0.441666,0.034736,0.40693
256,104.235143,69.171.250.60,192.168.43.53,TLSv1.2,582,Application Data,,,,,,,,,,,,,,,104.269879,104.235143,0.034736,9.4E-05,0.034642
257,104.269879,69.171.250.60,192.168.43.53,TLSv1.2,224,Application Data,,,,,,,,,,,,,,,104.269973,104.269879,9.4E-05,1.011835,1.011741
258,104.269973,192.168.43.53,69.171.250.60,TCP,54,53246  >  443 [ACK] Seq=1 Ack=11646 Win=64078 Len=0,,,,,,,,,,,,,,,105.281808,104.269973,1.011835,0.050919,0.960916
259,105.281808,69.171.250.60,192.168.43.53,TLSv1.2,224,Application Data,,,,,,,,,,,,,,,105.332727,105.281808,0.050919,9.316412,9.265493
260,105.332727,192.168.43.53,69.171.250.60,TCP,54,53246  >  443 [ACK] Seq=1 Ack=11816 Win=65280 Len=0,,,,,,,,,,,,,,,114.649139,105.332727,9.316412,16.735079,7.418667
263,114.649139,192.168.43.53,74.125.68.188,TCP,55,[TCP Keep-Alive] 53247  >  5228 [ACK] Seq=1 Ack=1 Win=257 Len=1,,,,,,,,,,,,,,,131.384218,114.649139,16.735079,0.306989,16.42809
264,131.384218,192.168.43.53,69.171.250.60,TLSv1.2,85,Application Data,,,,,,,,,,,,,,,131.691207,131.384218,0.306989,0.240312,0.066677
265,131.691207,69.171.250.60,192.168.43.53,TCP,54,443  >  53246 [ACK] Seq=11816 Ack=32 Win=22774 Len=0,,,,,,,,,,,,,,,131.931519,131.691207,0.240312,0.04542,0.194892
266,131.931519,69.171.250.60,192.168.43.53,TLSv1.2,92,Application Data,,,,,,,,,,,,,,,131.976939,131.931519,0.04542,4.590086,4.544666
267,131.976939,192.168.43.53,69.171.250.60,TCP,54,53246  >  443 [ACK] Seq=32 Ack=11854 Win=65242 Len=0,,,,,,,,,,,,,,,136.567025,131.976939,4.590086,0.044661,4.545425
268,136.567025,69.171.250.60,192.168.43.53,TLSv1.2,160,Application Data,,,,,,,,,,,,,,,136.611686,136.567025,0.044661,10.728345,10.683684
269,136.611686,192.168.43.53,69.171.250.60,TCP,54,53246  >  443 [ACK] Seq=32 Ack=11960 Win=65136 Len=0,,,,,,,,,,,,,,,147.340031,136.611686,10.728345,0.151437,10.576908
272,147.340031,192.168.43.53,74.125.68.138,TCP,55,[TCP Keep-Alive] 53441  >  443 [ACK] Seq=4416 Ack=2993 Win=65536 Len=1,,,,,,,,,,,,,,,147.491468,147.340031,0.151437,12.159467,12.00803
273,147.491468,74.125.68.138,192.168.43.53,TCP,54,[TCP Keep-Alive ACK] 443  >  53441 [ACK] Seq=2993 Ack=4417 Win=18016 Len=0,,,,,,,,,,,,,,,159.650935,147.491468,12.159467,1.729615,10.429852
275,159.650935,192.168.43.53,74.125.68.188,TCP,55,[TCP Keep-Alive] 53247  >  5228 [ACK] Seq=1 Ack=1 Win=257 Len=1,,,,,,,,,,,,,,,161.38055,159.650935,1.729615,0.292405,1.43721
278,161.38055,192.168.43.53,69.171.250.60,TLSv1.2,85,Application Data,,,,,,,,,,,,,,,161.672955,161.38055,0.292405,0.480226,0.187821
279,161.672955,69.171.250.60,192.168.43.53,TCP,54,443  >  53246 [ACK] Seq=11960 Ack=63 Win=22805 Len=0,,,,,,,,,,,,,,,162.153181,161.672955,0.480226,0.055178,0.425048
280,162.153181,69.171.250.60,192.168.43.53,TLSv1.2,92,Application Data,,,,,,,,,,,,,,,162.208359,162.153181,0.055178,1.066132,1.010954
281,162.208359,192.168.43.53,69.171.250.60,TCP,54,53246  >  443 [ACK] Seq=63 Ack=11998 Win=65098 Len=0,,,,,,,,,,,,,,,163.274491,162.208359,1.066132,8E-05,1.066052
282,163.274491,69.171.250.60,192.168.43.53,TLSv1.2,92,"[TCP Spurious Retransmission] , Application Data",,,,,,,,,,,,,,,163.274571,163.274491,8E-05,27.360968,27.360888
283,163.274571,192.168.43.53,69.171.250.60,TCP,66,[TCP Dup ACK 281#1] 53246  >  443 [ACK] Seq=63 Ack=11998 Win=65098 Len=0 SLE=11960 SRE=11998,,,,,,,,,,,,,,,190.635539,163.274571,27.360968,0.06691,27.294058
288,190.635539,192.168.43.53,69.171.250.60,TCP,66,53442  >  443 [SYN] Seq=0 Win=64240 Len=0 MSS=1460 WS=256 SACK_PERM=1,,,,,,,,,,,,,,,190.702449,190.635539,0.06691,0.089083,0.022173
289,190.702449,192.168.43.53,69.171.250.60,TCP,66,53443  >  443 [SYN] Seq=0 Win=64240 Len=0 MSS=1460 WS=256 SACK_PERM=1,,,,,,,,,,,,,,,190.791532,190.702449,0.089083,0,0.089083
290,190.791532,69.171.250.60,192.168.43.53,TCP,62,"443  >  53442 [SYN, ACK] Seq=0 Ack=1 Win=4380 Len=0 MSS=1360 SACK_PERM=1",,,,,,,,,,,,,,,190.791532,190.791532,0,0.000169,0.000169
291,190.791532,69.171.250.60,192.168.43.53,TCP,62,"443  >  53443 [SYN, ACK] Seq=0 Ack=1 Win=4380 Len=0 MSS=1360 SACK_PERM=1",,,,,,,,,,,,,,,190.791701,190.791532,0.000169,0.000408,0.000239
292,190.791701,192.168.43.53,69.171.250.60,TCP,54,53442  >  443 [ACK] Seq=1 Ack=1 Win=64240 Len=0,,,,,,,,,,,,,,,190.792109,190.791701,0.000408,0.000465,5.7E-05
293,190.792109,192.168.43.53,69.171.250.60,TCP,54,53443  >  443 [ACK] Seq=1 Ack=1 Win=64240 Len=0,,,,,,,,,,,,,,,190.792574,190.792109,0.000465,0.000902,0.000437
294,190.792574,192.168.43.53,69.171.250.60,TLSv1.3,571,Client Hello,,,,,,,,,,,,,,,190.793476,190.792574,0.000902,0.306591,0.305689
295,190.793476,192.168.43.53,69.171.250.60,TLSv1.3,571,Client Hello,,,,,,,,,,,,,,,191.100067,190.793476,0.306591,0.12499,0.181601
296,191.100067,192.168.43.53,69.171.250.60,TCP,571,"[TCP Retransmission] 53443  >  443 [PSH, ACK] Seq=1 Ack=1 Win=64240 Len=517",,,,,,,,,,,,,,,191.225057,191.100067,0.12499,0.156735,0.031745
297,191.225057,192.168.43.53,69.171.250.60,TCP,571,"[TCP Retransmission] 53442  >  443 [PSH, ACK] Seq=1 Ack=1 Win=64240 Len=517",,,,,,,,,,,,,,,191.381792,191.225057,0.156735,0.061997,0.094738
298,191.381792,192.168.43.53,69.171.250.60,TLSv1.2,85,Application Data,,,,,,,,,,,,,,,191.443789,191.381792,0.061997,0.281219,0.219222
299,191.443789,192.168.43.53,69.171.250.60,TCP,571,"[TCP Retransmission] 53443  >  443 [PSH, ACK] Seq=1 Ack=1 Win=64240 Len=517",,,,,,,,,,,,,,,191.725008,191.443789,0.281219,0.187491,0.093728
300,191.725008,192.168.43.53,69.171.250.60,TCP,571,"[TCP Retransmission] 53442  >  443 [PSH, ACK] Seq=1 Ack=1 Win=64240 Len=517",,,,,,,,,,,,,,,191.912499,191.725008,0.187491,0.140633,0.046858
